{
  "schema_version": "1.0.0",
  "record_type": "external_claim",
  "record_id": "external_claim.yu2023_bound_statement.v1",
  "packet_id": "frontier.formal_conjectures.union_closed_sharpness.v1",
  "environment_hash": "9e26d28efe88484c36562da27aa22a2cc73a0638d11532cbbc9071a60609025d",
  "created_at": "2026-07-12T00:00:00Z",
  "trust_status": "candidate_unverified",
  "export_eligibility": "restricted",
  "record_hash": "b3d738c8d3e183be7222e1f348984cf7e2be27bc0c9a47dffbeedaade90dce75",
  "literature_source_id": "literature_source.yu2023_union_closed_bound.v1",
  "retrieved_passage_id": null,
  "claim_text": "Improves the general-case (still-open) union-closed sets conjecture bound to approximately 0.38234, via a different theorem than this packet's sharpness-of-1/2 result.",
  "claim_type": "theorem_statement",
  "formal_statement_sha256": null
}
