{
  "schema_version": "1.0.0",
  "record_type": "external_claim",
  "record_id": "external_claim.frankl_conjecture_statement.v1",
  "packet_id": "frontier.formal_conjectures.union_closed_sharpness.v1",
  "environment_hash": "9e26d28efe88484c36562da27aa22a2cc73a0638d11532cbbc9071a60609025d",
  "created_at": "2026-07-12T00:00:00Z",
  "trust_status": "candidate_unverified",
  "export_eligibility": "public",
  "record_hash": "9d956e4f720fea49d0a52e0d4fe66f99184f1f79474d260aff1a10c421dae78a",
  "literature_source_id": "literature_source.wikipedia_union_closed_sets.v1",
  "retrieved_passage_id": null,
  "claim_text": "For every finite union-closed family A of sets other than {the empty set}, some element belongs to at least half of the sets in A (Frankl's conjecture).",
  "claim_type": "conjecture",
  "formal_statement_sha256": null
}
